"DealerId","FeedId","VIN","Stock","Mileage","Year","Make","Model","Trim","Body","Transmission","Engine","IntColor","ExtColor","GenericIntColor","GenericExtColor","Price","RetailPrice","DealerCost","ModelCode","ExtColorCode","IntColorCode","Certified","Condition","InDate","Comments","ImageURLs","Options","StandardEquipment","OptionCodes","MPGCity","MPGHighway","Doors","Drivetrain","CabType"
"11327","11327","1G1PE5SB9G7103374","FC7226A","48942","2016","Chevrolet","Cruze Limited","5 1LT","Sedan","","Ecotec Turbo 1.4L VVT DOHC 4-Cyl Sequential MFI Engine","","SPECIAL","","","12104","","10097","1PX69","","","0","Used","2018-08-08","Looking for a clean, well-cared for 2016 Chevrolet Cruze Limited? This is it. Drive home in your new pre-owned vehicle with the knowledge you're fully backed by the CARFAX Buyback Guarantee. If you are looking for a vehicle with great styling, options and incredible fuel economy, look no further than this quality automobile. This is the one. Just what you've been looking for. More information about the 2016 Chevrolet Cruze Limited: The 2016 Cruze Limited is a refined compact sedan, offering a choice of powertrains, excellent ride comfort and top-tier safety features and amenities. The Cruze Limited is built on a global platform and its safety performance has been tested and proven with top results in many of the world's crash-test programs. It also offers more active safety options than is typical in this class. For those who want to keep compact but use the back seat occasionally, the Cruze Limited is particularly roomy, with a quiet, comfortable ride and some excellent connectivity with the Chevrolet MyLink. Strengths of this model include Roomy interior, great fuel economy in ECO variant, affordable pricing, smooth ride, and excellent safety and occupant protection","http://s3.amazonaws.com/photos.ecarlist.com/RtAa/Re8T/Rfw8/QkqS/ioDL/lA_640.jpg|http://s3.amazonaws.com/photos.ecarlist.com/aYJ1/oZ9J/R5nQ/HMj7/e0IR/Iw_640.jpg|http://s3.amazonaws.com/photos.ecarlist.com/EIqP/p2qj/8D2V/WX14/noDL/2Q_640.jpg|http://s3.amazonaws.com/photos.ecarlist.com/EDL2/uy7o/Dabo/Yk22/yI2u/3w_640.jpg|http://s3.amazonaws.com/photos.ecarlist.com/fHaW/00W9/9Lt5/aqTr/PLov/AQ_640.jpg|http://s3.amazonaws.com/photos.ecarlist.com/ErLu/D8ZF/tId8/S6O1/4n1p/Rg_640.jpg|http://s3.amazonaws.com/photos.ecarlist.com/E1Kh/uWhn/FQ6x/Hhah/XQPY/vQ_640.jpg|http://s3.amazonaws.com/photos.ecarlist.com/t8L5/tUwl/R51Z/USPo/Vy1x/zg_640.jpg|http://s3.amazonaws.com/photos.ecarlist.com/BN1L/2Z21/ZJBb/QSv7/rkea/KA_640.jpg|http://s3.amazonaws.com/photos.ecarlist.com/cWLM/Eh18/Mi2E/pp8U/VbPi/5g_640.jpg|http://s3.amazonaws.com/photos.ecarlist.com/JCoQ/FBBJ/qsf5/DvX5/YDXt/FA_640.jpg|http://s3.amazonaws.com/photos.ecarlist.com/hglI/YDCf/r2fp/0Udu/oBvC/tQ_640.jpg|http://s3.amazonaws.com/photos.ecarlist.com/EsjB/0fRl/gDBT/h9c8/xp20/nQ_640.jpg|http://s3.amazonaws.com/photos.ecarlist.com/8iXN/2qVv/C2QT/Bdcy/HN7H/sA_640.jpg|http://s3.amazonaws.com/photos.ecarlist.com/8aNy/tLpq/F1dW/Y6hA/w286/SA_640.jpg|http://s3.amazonaws.com/photos.ecarlist.com/rDov/wSk1/QmEA/QCWF/VLjc/6Q_640.jpg|http://s3.amazonaws.com/photos.ecarlist.com/KVp0/C1nS/sbF3/lazo/AnhB/2A_640.jpg|http://s3.amazonaws.com/photos.ecarlist.com/OTDf/0ySf/848Z/z28X/dzZA/CQ_640.jpg|http://s3.amazonaws.com/photos.ecarlist.com/cjB3/6HJP/oQTD/u8nn/u1Qf/1Q_640.jpg|http://s3.amazonaws.com/photos.ecarlist.com/y62o/640j/RPIS/X1C1/DQGj/7Q_640.jpg|http://s3.amazonaws.com/photos.ecarlist.com/5Bn1/kYkn/yd34/F0bI/jwJn/4w_640.jpg|http://s3.amazonaws.com/photos.ecarlist.com/qK3y/cIMX/kwUS/8x9y/pR8e/bQ_640.jpg|http://s3.amazonaws.com/photos.ecarlist.com/8PgZ/iog8/Wj0B/2tzR/RW6I/TQ_640.jpg|http://s3.amazonaws.com/photos.ecarlist.com/JFXV/bSuR/85K1/71Gv/PhaN/2w_640.jpg|http://s3.amazonaws.com/photos.ecarlist.com/ek27/KXsa/ybjA/qcNK/EbIc/qQ_640.jpg|http://s3.amazonaws.com/photos.ecarlist.com/Dp92/pT1G/hoRv/ALSY/4bze/TA_640.jpg","","Bluetooth for phone personal cell phone connectivity to vehicle audio system and HMI (Human Machine Interface)|Enhanced Acoustic Package|Audio system AM/FM stereo with CD player and MP3 playback capability, graphical display|Audio interface, USB port, located in center console (Deleted when PCR Technology Package is ordered.)|OnStar with 4G LTE and built-in Wi-Fi hotspot to connect to the internet 4G LTE speeds, includes 3GB or 3 months OnStar Data Trial (whichever comes first) (Available 4G LTE Wi-Fi requires compatible mobile device, active OnStar subscription and data plan after trial.)|Audio system feature, auxiliary input jack, located in center console|Audio system feature, 6-speaker system|Lamp, LED center high-mounted stop/brake (CHMSL)|Wipers, front intermittent, variable|Tire, compact spare and spare wheel, includes jack and lug nut wrench|Door handles, body-color|Wheels, 16 (40.6 cm) painted aluminum|1LT Exterior Appearance includes LS Exterior Appearance content plus body-color outside mirrors, chrome belt moldings and 16 (40.6 cm) painted aluminum wheels|Mirrors, outside, power-adjustable, manual-folding (Mirror caps are body-color.)|Daytime Running Lamps, LED|Tires, P215/60R16, all-season, blackwall, low rolling resistance|Glass, solar absorbing, tinted|Headlamps, halogen composite with automatic exterior lamp control and delay feature|Compass display|Floor mats, carpeted front and rear|Steering wheel controls, mounted audio and phone interface controls|Defogger, rear-window, electric|Remote Keyless Entry|Door locks, power, programmable, with lockout protection|Lighting, interior dome with theater dimming, dual map lights, illuminated trunk area|Convenience hooks, rear|Center stack, integrated with ambient LED back lighting|Cup holders 2 in front center console, 2 in rear seat armrest and 1 bottle holder in each front door panel|Power outlets, 2 auxiliary, located in center console|Seat, rear 60/40 split-folding with adjustable head restraints on outboard positions|Driver Information Center with trip odometer, fuel range, average fuel economy, instantaneous fuel economy, average vehicle speed, tire pressure, oil life remaining and compass|Console, center with sliding armrest, storage, front and rear 12-volt auxiliary power outlets and dual cup holders|Theft-deterrent system with anti-theft alarm and engine immobilizer|Oil life monitoring system|LS, 1LT and ECO Interior Appearance includes Premium cloth seating, Silver-painted center stack and instrument panel cluster accent rings, and open instrument panel storage bin|Air conditioning, single-zone electronic includes air filter|Cruise control|Seats, front bucket with reclining seatbacks and adjustable head restraints|Seat adjuster, driver 6-way manual|Armrest, rear center, articulating, with dual cup holders|Windows, power with Express-Down on all and driver Express Up|Seat adjuster, front passenger 6-way manual|Seat trim, Premium cloth|Visors, driver and front passenger vanity mirrors|Mirror, inside rearview manual day/night|Steering wheel, 3-spoke, comfort grip|Assist handles, driver, front passenger and rear outboard|Rear air ducts, floor mounted|Steering column, tilt and telescopic|Steering, power, electric, rack-mounted|Brakes, front disc/rear drum|Front wheel drive|Suspension, front independent McPherson strut, aluminum control arms with hydraulic bushings, 25mm hollow stabilizer bar|Battery, 438 cold-cranking amps|Engine, ECOTEC Turbo 1.4L Variable Valve Timing DOHC 4-cylinder sequential MFI (138 hp [103 kW] @ 4900 rpm, 148 lb-ft of torque [199.8 N-m] @ 1850 rpm)|Transmission, 6-speed automatic, electronically controlled with overdrive|Suspension, rear, compound crank|Alternator, 130 amps|Axle, 3.53 final drive ratio|OnStar Guidance Plan for 6 months including Automatic Crash Response, Stolen Vehicle Assistance, Roadside Assistance, Turn-by-Turn Navigation, Advanced Diagnostics and more (trial excludes Hands-Free Calling) (Visit www.onstar.com for coverage map, details and system limitations. Services may vary by model and conditions.)|Safety belt pretensioners, driver and front passenger, dual|StabiliTrak, stability control system|Brakes, 4-wheel antilock|Trunk emergency release handle|OnStar Basic Plan for 5 years including limited RemoteLink mobile app services, Advanced Diagnostics and Dealer Maintenance Notification (Basic Plan available for 5 years from the date of vehicle delivery, and is transferable. Does not include Emergency, Security or Navigation services.)|Air bags, frontal and knee for driver and front passenger, side-impact seat-mounted and roof rail for front and rear outboard seating positions includes Passenger Sensing System (Always use safety belts and child restraints. Children are safer when properly secured in a rear seat in the appropriate child restraint. See the Owner's Manual for more information.)|Daytime Running Lamps|Door locks, rear child security|LATCH system (Lower Anchors and Top tethers for CHildren), for child safety seats|Safety belts, 3-point, all seating positions, front height adjustable|Tire Pressure Monitor|Traction control","","26","38","4","Front Wheel Drive",""
"11327","11327","1C4AJWAG8GL156960","T8251A","53955","2016","Jeep","Wrangler","Sport","","Automatic","3.6L V6 Cylinder Engine","Black","Firecracker Red Clearcoat","","Red","23212","","19526","JKJL72","PRC","A7X9","0","Used","2018-08-14","Check out this gently-used 2016 Jeep Wrangler we recently got in. Your buying risks are reduced thanks to a CARFAX BuyBack Guarantee. The Jeep Wrangler is the benchmark all other SUVs strive to meet. With exceptional power, towing and handling, this SUV can handle anything thrown at it. This 4WD-equipped vehicle will handle majestically on any terrain and in any weather condition your may find yourself in. The benefits of driving an Four Wheel Drive vehicle, such as this JeepWrangler 4WD 2dr Sport, include superior acceleration, improved steering, and increased traction and stability. More information about the 2016 Jeep Wrangler: With prices starting at a little under $23,000 with standard 4-wheel drive, the classic Wrangler is one of the best SUV values available. The 6-speed manual transmission helps the Wrangler achieve a decent 17 mpg city and 21 mpg highway rating. Jeep considers the Wrangler's off-road prowess integral to the brand and they continue to make one of the most capable 4-wheel drive vehicles available. This model sets itself apart with Iconic styling, impressive off-road prowess, and 2- and 4-door configurations available","http://s3.amazonaws.com/photos.ecarlist.com/alSx/iolj/78H2/Cbs2/lRBl/QQ_640.jpg|http://s3.amazonaws.com/photos.ecarlist.com/ZVAj/4zXG/2mOd/cbXG/sA2T/rQ_640.jpg|http://s3.amazonaws.com/photos.ecarlist.com/27M1/PAGX/PKki/Ke1H/YXKy/ww_640.jpg|http://s3.amazonaws.com/photos.ecarlist.com/PUck/X0hw/8IVE/OtmB/3Q5a/dQ_640.jpg|http://s3.amazonaws.com/photos.ecarlist.com/HIfn/KrUZ/HC3C/8ekC/WWJE/ow_640.jpg|http://s3.amazonaws.com/photos.ecarlist.com/gIo2/UhN1/QZPf/JegW/KvtH/Aw_640.jpg|http://s3.amazonaws.com/photos.ecarlist.com/Y5Dg/DqiM/JDWS/PkXq/EIqa/Xg_640.jpg|http://s3.amazonaws.com/photos.ecarlist.com/6JY1/AZ0o/wsK5/RUUx/eXwm/Ng_640.jpg|http://s3.amazonaws.com/photos.ecarlist.com/YJbt/Dr5e/8qHy/DhF1/GeJg/2Q_640.jpg|http://s3.amazonaws.com/photos.ecarlist.com/eX9d/8E1P/v7G5/VDay/O1so/yg_640.jpg|http://s3.amazonaws.com/photos.ecarlist.com/76vm/OVwO/Y0AE/7Buu/RB6u/yA_640.jpg|http://s3.amazonaws.com/photos.ecarlist.com/Utsd/4lbo/96uj/lMIK/sdJD/2w_640.jpg|http://s3.amazonaws.com/photos.ecarlist.com/iiZG/i5SV/iwdB/z4Cg/THHL/dQ_640.jpg|http://s3.amazonaws.com/photos.ecarlist.com/s8TJ/5FDt/pvyQ/WHf3/uF3a/IQ_640.jpg|http://s3.amazonaws.com/photos.ecarlist.com/X2zn/DcRs/JuAG/oxUZ/RZGE/4A_640.jpg|http://s3.amazonaws.com/photos.ecarlist.com/EDHa/i5sS/yonv/sgWG/BC2G/wA_640.jpg|http://s3.amazonaws.com/photos.ecarlist.com/4OUF/53c0/vZph/9Q5h/uaiq/Kw_640.jpg|http://s3.amazonaws.com/photos.ecarlist.com/TVtj/BGnM/16yb/IYFf/m5Cv/CQ_640.jpg|http://s3.amazonaws.com/photos.ecarlist.com/iBJg/We9c/hX4C/b6sB/JfZj/1Q_640.jpg|http://s3.amazonaws.com/photos.ecarlist.com/5R3N/Wxsz/B0Zd/wDgH/01WF/hQ_640.jpg|http://s3.amazonaws.com/photos.ecarlist.com/MCAV/ygjT/suys/1tF2/1LCD/yQ_640.jpg|http://s3.amazonaws.com/photos.ecarlist.com/1fDh/zR0a/v2UC/USNi/C627/2g_640.jpg|http://s3.amazonaws.com/photos.ecarlist.com/KTG9/jDna/ih56/3hWE/iZxN/Ug_640.jpg|http://s3.amazonaws.com/photos.ecarlist.com/LrIy/5hly/jDbV/rxDF/pDq9/hg_640.jpg|http://s3.amazonaws.com/photos.ecarlist.com/54DJ/fYw5/sCzT/K7m2/n3ZN/ew_640.jpg|http://s3.amazonaws.com/photos.ecarlist.com/cIRk/23t0/NAif/6bbU/TQ8d/lQ_640.jpg|http://s3.amazonaws.com/photos.ecarlist.com/kOPE/xuix/yL2F/lsp7/IsKw/DA_640.jpg","","Radio: 130|Fixed Antenna|Radio w/Seek-Scan, In-Dash Mounted Single CD, MP3 Player, Clock and Steering Wheel Controls|8 Speakers|1 LCD Monitor In The Front|Audio Jack Input for Mobile Devices|Black Fender Flares|Conventional Rear Cargo Access|Black Front Bumper w/2 Tow Hooks|Steel Spare Wheel|Aero-Composite Halogen Headlamps|Wheels: 16 x 7.0 Luxury Styled Steel|Tires: P225/75R16 BSW On/Off Road|Front Fog Lamps|Light Tinted Glass|Black Door Handles|Clearcoat Paint|Convertible w/Fixed Roll-Over Protection|Black Rear Bumper w/1 Tow Hook|Black Manual Side Mirrors w/Manual Folding|Full-Size Spare Tire Mounted Outside Rear|Fully Galvanized Steel Panels|Variable Intermittent Wipers|Body-Colored Grille|Black Side Windows Trim|Sunrider Soft Top|Removable Rear Window|Manual Tailgate/Rear Door Lock|Full Carpet Floor Covering -inc: Carpet Front Floor Mats|Outside Temp Gauge|Trip Computer|Urethane Gear Shift Knob|Locking Cargo Area Concealed Storage|Manual Tilt Steering Column|Analog Display|Rear Cupholder|6-Way Driver Seat -inc: Manual Recline, Height Adjustment and Fore/Aft Movement|Locking Glove Box|Manual 1st Row Windows|Full Floor Console w/Locking Storage and 2 12V DC Power Outlets|Cruise Control w/Steering Wheel Controls|Day-Night Rearview Mirror|Carpet Floor Trim, Carpet And Rubber Mat|Interior Trim -inc: Metal-Look Instrument Panel Insert, Metal-Look Door Panel Insert and Metal-Look Interior Accents|Front Center Armrest w/Storage|Delayed Accessory Power|Driver And Passenger Visor Vanity Mirrors|Sentry Key Engine Immobilizer|Removable Rear Windows|2 12V DC Power Outlets|2 Seatback Storage Pockets|Manual Adjustable Front Head Restraints and Fixed Rear Head Restraints|Fade-To-Off Interior Lighting|Front Cupholder|Instrument Panel Bin, Dashboard Storage, Driver And Passenger Door Bins|Compass|Cloth Seats w/Adjustable Head Restraints|4-Way Passenger Seat -inc: Manual Recline, Fore/Aft Movement and Manual Rear Seat Easy Entry|Removable Full Folding Bench Front Facing Tumble Forward Rear Seat|Gauges -inc: Speedometer, Odometer, Engine Coolant Temp, Tachometer, Trip Odometer and Trip Computer|Single Stainless Steel Exhaust|Trailing Arm Rear Suspension w/Coil Springs|Towing w/Trailer Sway Control|Front And Rear Anti-Roll Bars|GVWR: 4,900 lbs|Brake Actuated Limited Slip Differential|160 Amp Alternator|Hydraulic Power-Assist Steering|50 State Emissions|Leading Link Front Suspension w/Coil Springs|Part-Time Four-Wheel Drive|Transmission: 6-Speed Manual (NSG370)|Engine Oil Cooler|1000# Maximum Payload|3.21 Rear Axle Ratio|18.6 Gal. Fuel Tank|600CCA Maintenance-Free Battery|4-Wheel Disc Brakes w/4-Wheel ABS, Front And Rear Vented Discs, Brake Assist and Hill Hold Control|Manual Transfer Case|Auto Locking Hubs|Normal Duty Suspension|Engine: 3.6L V6 24V VVT|2 Skid Plates|Gas-Pressurized Shock Absorbers|ABS Traction Control|Side Impact Beams|Low Tire Pressure Warning|Dual Stage Driver And Passenger Front Airbags|Airbag Occupancy Sensor|Outboard Front Lap And Shoulder Safety Belts -inc: Height Adjusters and Pretensioners|Electronic Stability Control (ESC) And Roll Stability Control (RSC)","","17","21","2","Four Wheel Drive",""
"11327","11327","3C63RRGL0GG137931","NT8103A","40742","2016","Ram","3500","Tradesman","","","6.7L Straight 6-Cyl Engine","","RED","","","40446","","36445","D28L92","","","0","Used","2018-08-31","This 2016 Ram 3500 4WD Crew Cab 169 Tradesman is proudly offered by Downs Ford Your buying risks are reduced thanks to a CARFAX BuyBack Guarantee. Where do you want to go today? With 4WD, you can choose to drive virtually anywhere and on terrain 2WD vehicles can't handle. This is the one. Just what you've been looking for. More information about the 2016 Ram 3500: Ram 2500 models are intended for the most extreme personal-towing needs, while the 3500 models are aimed at heavy commercial use by ranchers or construction crews. With the diesel model's gains in fuel efficiency, as well as other maintenance-related improvements, running costs should be down versus these trucks' predecessors. Even compared to the other latest heavy-duty trucks, the Ram 2500 and 3500 HD models have some of the best-appointed, most luxurious and most attractive interiors, picking up much of the look and some of the high-line materials from the latest light-duty Ram trucks. This model sets itself apart with luxury options, excellent powertrain warranty, available Uconnect technology, tow ratings up to 30,000 pounds, Best-in-class features across multiple categories, and impressive powertrain offerings","http://s3.amazonaws.com/photos.ecarlist.com/I8ei/DrUh/9iaD/2SMb/1oy0/zw_640.jpg|http://s3.amazonaws.com/photos.ecarlist.com/vdTw/TFap/ixJi/2Opr/R54Y/6g_640.jpg|http://s3.amazonaws.com/photos.ecarlist.com/KZvj/UnNp/SdYS/8oti/k10X/JQ_640.jpg|http://s3.amazonaws.com/photos.ecarlist.com/X2T7/Y6jq/YwBL/BGhr/NyB1/9w_640.jpg|http://s3.amazonaws.com/photos.ecarlist.com/52Fi/Kn5b/1APP/plEw/H4Fj/gQ_640.jpg|http://s3.amazonaws.com/photos.ecarlist.com/3aUY/Stkc/gvQ0/8gIp/VV1d/VQ_640.jpg|http://s3.amazonaws.com/photos.ecarlist.com/Htcu/03dS/Y8mE/ZjD3/V0O2/Mg_640.jpg|http://s3.amazonaws.com/photos.ecarlist.com/k3fp/EJb9/iYD4/3MG9/RNDE/eA_640.jpg|http://s3.amazonaws.com/photos.ecarlist.com/hpC1/lRwm/dg2t/lsg2/Agry/1g_640.jpg|http://s3.amazonaws.com/photos.ecarlist.com/12HR/Qjc2/3IvC/jtUa/220g/UA_640.jpg|http://s3.amazonaws.com/photos.ecarlist.com/R3QV/0qnk/Coo7/yZ9M/tblB/Hg_640.jpg|http://s3.amazonaws.com/photos.ecarlist.com/SqJf/1rQD/1Qlv/eXk6/19XN/nw_640.jpg|http://s3.amazonaws.com/photos.ecarlist.com/JZTG/F3ZD/lqtO/Apgx/DdJw/bw_640.jpg|http://s3.amazonaws.com/photos.ecarlist.com/1F9q/VKgf/lnyS/5Z4d/sHgl/eQ_640.jpg|http://s3.amazonaws.com/photos.ecarlist.com/SH3X/m17T/zkUf/WvW4/HiXa/sA_640.jpg|http://s3.amazonaws.com/photos.ecarlist.com/vKh4/YUg4/LGGU/Bomd/Fm14/FQ_640.jpg|http://s3.amazonaws.com/photos.ecarlist.com/63Te/3gX7/Vtke/N3E0/ZVeq/yw_640.jpg|http://s3.amazonaws.com/photos.ecarlist.com/9rgy/GC39/ZPfD/e69w/yoOB/Hw_640.jpg|http://s3.amazonaws.com/photos.ecarlist.com/Z14e/k82D/qqzl/uiU2/9xvx/tg_640.jpg|http://s3.amazonaws.com/photos.ecarlist.com/8MKp/24xc/iY84/raeo/m035/hA_640.jpg|http://s3.amazonaws.com/photos.ecarlist.com/WXz2/0I0b/lhcp/SxYZ/V56j/MA_640.jpg|http://s3.amazonaws.com/photos.ecarlist.com/JMvn/8qKi/riy6/AZCC/tmb2/kg_640.jpg|http://s3.amazonaws.com/photos.ecarlist.com/54xl/1i67/OBrg/pZWH/Eeoe/Aw_640.jpg|http://s3.amazonaws.com/photos.ecarlist.com/I1qW/n96D/2kWv/YX2s/ZKLu/sQ_640.jpg|http://s3.amazonaws.com/photos.ecarlist.com/NUaX/348e/TcMM/J13r/dzUw/Tg_640.jpg|http://s3.amazonaws.com/photos.ecarlist.com/iwcS/yvZb/g1VU/QyLN/ljMk/3A_640.jpg|http://s3.amazonaws.com/photos.ecarlist.com/uALU/tXoG/rmZ0/qtRj/p5Hv/zw_640.jpg|http://s3.amazonaws.com/photos.ecarlist.com/1eTn/1qQ3/Czkn/X5aF/3qNX/Rw_640.jpg|http://s3.amazonaws.com/photos.ecarlist.com/nSst/g0bj/fN8O/5OqJ/yDzH/mQ_640.jpg|http://s3.amazonaws.com/photos.ecarlist.com/2e4I/83Kq/rjcf/1UAr/tuxU/0Q_640.jpg","","Radio w/Seek-Scan, Clock and Radio Data System|Radio: 3.0|6 Speakers|Fixed Antenna|Media Hub (2 USB, AUX)|Black Side Windows Trim and Black Front Windshield Trim|Tailgate Rear Cargo Access|Perimeter/Approach Lights|Clearcoat Paint|Full-Size Spare Tire Stored Underbody w/Crankdown|Black Rear Step Bumper|Variable Intermittent Wipers|Regular Box Style|Fully Galvanized Steel Panels|Black Door Handles|Black Front Bumper w/2 Tow Hooks|Fully Automatic Aero-Composite Halogen Headlamps w/Delay-Off|Cargo Lamp w/High Mount Stop Light|Black Grille|Wheels: 18 x 8.0 Steel|Fixed Rear Window|Black Power Heated Side Mirrors w/Convex Spotter, Manual Folding and Turn Signal Indicator|Front License Plate Bracket|Deep Tinted Glass|Steel Spare Wheel|Manual Extendable Trailer Style Mirrors|Front Bumper Sight Shields|Tires: LT275/70R18E BSW AS|Manual Tailgate/Rear Door Lock|Front Center Armrest and Rear Center Armrest|Glove Box|Manual Adjustable Front Head Restraints and Manual Adjustable Rear Head Restraints|Gauges -inc: Speedometer, Odometer, Voltmeter, Oil Pressure, Engine Coolant Temp, Tachometer, Oil Temperature, Transmission Fluid Temp, Engine Hour Meter and Trip Odometer|Power 1st Row Windows w/Driver And Passenger 1-Touch Up/Down|2 12V DC Power Outlets|Fade-To-Off Interior Lighting|Systems Monitor|Analog Display|Sentry Key Engine Immobilizer|Day-Night Rearview Mirror|HD Vinyl 40/20/40 Split Bench Seat|Cruise Control w/Steering Wheel Controls|Interior Trim -inc: Deluxe Sound Insulation, Metal-Look Instrument Panel Insert and Chrome/Metal-Look Interior Accents|Delayed Accessory Power|Cargo Area Concealed Storage|Manual Tilt Steering Column|40/20/40 Split Bench Seat|Instrument Panel Bin, Dashboard Storage, Driver / Passenger And Rear Door Bins and 2nd Row Underseat Storage|4-Way Passenger Seat -inc: Manual Recline and Fore/Aft Movement|4-Way Driver Seat -inc: Manual Recline and Fore/Aft Movement|Power Door Locks w/Autolock Feature|Front Cupholder|Cruise Control w/Steering Wheel Controls|Full Vinyl/Rubber Floor Covering|Mini Floor Console|Manual Air Conditioning|HVAC -inc: Underseat Ducts and Console Ducts|Pickup Cargo Box Lights|4-Way Passenger Seat -inc: Manual Recline and Fore/Aft Movement|Full Cloth Headliner|Power Rear Windows|Rear Folding Seat|Engine: 5.7L V8 HEMI VVT|Part-Time Four-Wheel Drive|Auto Locking Hubs|730CCA Maintenance-Free Battery w/Run Down Protection|Single Stainless Steel Exhaust|Front Anti-Roll Bar|Multi-Link Front Suspension w/Coil Springs|4390# Maximum Payload|50 State Emissions|GVWR: 11,300 lbs|Transmission: 6-Speed Automatic 66RFE|Mechanical Limited Slip Differential|Class V Towing Equipment -inc: Harness, Hitch and Trailer Sway Control|Leaf Rear Suspension w/Leaf Springs|Manual Transfer Case|3.73 Rear Axle Ratio|HD Shock Absorbers|Electronically Controlled Throttle|32 Gal. Fuel Tank|4-Wheel Disc Brakes w/4-Wheel ABS, Front And Rear Vented Discs, Brake Assist and Hill Hold Control|Transmission w/Driver Selectable Mode, Sequential Shift Control and Oil Cooler|160 Amp Alternator|Hydraulic Power-Assist Steering|Tip Start|Airbag Occupancy Sensor|ABS And Driveline Traction Control|Rear Child Safety Locks|Electronic Stability Control (ESC)|ABS And Driveline Traction Control|Curtain 1st And 2nd Row Airbags|Tire Specific Low Tire Pressure Warning|Dual Stage Driver And Passenger Front Airbags|Electronic Stability Control (ESC)|Dual Stage Driver And Passenger Front Airbags","","0","0","4","Four Wheel Drive",""
